{
  "puzzleId": "cl-f1ae6a384294a8475e74d279",
  "dataContentSha256": "f9d1b24aa47bb4729d03963b6612b553f61e2e058581dc500773bdedfeab6287",
  "mode": "clue_ladder",
  "answerStateId": "US-ME",
  "orderedClueIds": [
    "me.population.1-1_5m",
    "me.time.eastern-all",
    "me.area.rank-36-40",
    "me.history.1820s",
    "me.highpoint.5000-5500",
    "me.parks.acadia",
    "me.postal"
  ],
  "dataSnapshotId": "us-states-2026-09-06-v1",
  "clueSetVersion": "short-seven-all-states-v1",
  "scoring": {
    "maxByRung": [
      1000,
      900,
      800,
      700,
      600,
      500,
      400
    ],
    "wrongGuessPenalty": 50
  },
  "seed": "short-seven-all-states-v1",
  "generatedAt": "2026-09-06T16:00:00Z",
  "validatorVersion": "clue-ladder-1"
}
