{
  "puzzleId": "cl-1119b77414706e81fb16e96e",
  "dataContentSha256": "f9d1b24aa47bb4729d03963b6612b553f61e2e058581dc500773bdedfeab6287",
  "mode": "clue_ladder",
  "answerStateId": "US-KY",
  "orderedClueIds": [
    "ky.parks.formal-1",
    "ky.time.eastern-central",
    "ky.area.rank-36-40",
    "ky.history.1790s",
    "ky.population.4_5-5m",
    "ky.highpoint.4000-4500",
    "ky.postal"
  ],
  "dataSnapshotId": "us-states-2026-09-06-v1",
  "clueSetVersion": "short-seven-all-states-v1",
  "scoring": {
    "maxByRung": [
      1000,
      900,
      800,
      700,
      600,
      500,
      400
    ],
    "wrongGuessPenalty": 50
  },
  "seed": "short-seven-all-states-v1",
  "generatedAt": "2026-09-06T16:00:00Z",
  "validatorVersion": "clue-ladder-1"
}
