{
  "puzzleId": "cl-d353902e053451e4d14aa324",
  "dataContentSha256": "f9d1b24aa47bb4729d03963b6612b553f61e2e058581dc500773bdedfeab6287",
  "mode": "clue_ladder",
  "answerStateId": "US-GA",
  "orderedClueIds": [
    "ga.time.eastern",
    "ga.history.1780s",
    "ga.population.9000000-12000000",
    "ga.parks.formal-0",
    "ga.nps.martin-luther-king-jr",
    "ga.places.top-two-2025",
    "ga.postal"
  ],
  "dataSnapshotId": "us-states-2026-09-06-v1",
  "clueSetVersion": "short-seven-all-states-v1",
  "scoring": {
    "maxByRung": [
      1000,
      900,
      800,
      700,
      600,
      500,
      400
    ],
    "wrongGuessPenalty": 50
  },
  "seed": "short-seven-all-states-v1",
  "generatedAt": "2026-09-06T16:00:00Z",
  "validatorVersion": "clue-ladder-1"
}
