{
  "puzzleId": "cl-3cf9cff82ef0d745ad0f45c9",
  "dataContentSha256": "f9d1b24aa47bb4729d03963b6612b553f61e2e058581dc500773bdedfeab6287",
  "mode": "clue_ladder",
  "answerStateId": "US-WA",
  "orderedClueIds": [
    "wa.population.7000000-9000000",
    "wa.parks.formal-3",
    "wa.history.order-41-50",
    "wa.area.rank-16-20",
    "wa.nps.mount-rainier",
    "wa.places.top-two-2025",
    "wa.postal"
  ],
  "dataSnapshotId": "us-states-2026-09-06-v1",
  "clueSetVersion": "short-seven-all-states-v1",
  "scoring": {
    "maxByRung": [
      1000,
      900,
      800,
      700,
      600,
      500,
      400
    ],
    "wrongGuessPenalty": 50
  },
  "seed": "short-seven-all-states-v1",
  "generatedAt": "2026-09-06T16:00:00Z",
  "validatorVersion": "clue-ladder-1"
}
