{
  "puzzleId": "cl-d8f369ebd6b3366108a5e862",
  "dataContentSha256": "f9d1b24aa47bb4729d03963b6612b553f61e2e058581dc500773bdedfeab6287",
  "mode": "clue_ladder",
  "answerStateId": "US-CA",
  "orderedClueIds": [
    "ca.history.1840-1860",
    "ca.area.rank-1-5",
    "ca.population.30m-plus",
    "ca.time.pacific-all",
    "ca.business.google-first-office",
    "ca.cities.top2-2025",
    "ca.postal"
  ],
  "dataSnapshotId": "us-states-2026-09-06-v1",
  "clueSetVersion": "short-seven-all-states-v1",
  "scoring": {
    "maxByRung": [
      1000,
      900,
      800,
      700,
      600,
      500,
      400
    ],
    "wrongGuessPenalty": 50
  },
  "seed": "short-seven-all-states-v1",
  "generatedAt": "2026-09-06T16:00:00Z",
  "validatorVersion": "clue-ladder-1"
}
