{
  "puzzleId": "cl-1528ad3dbcf16132e6b92585",
  "dataContentSha256": "f9d1b24aa47bb4729d03963b6612b553f61e2e058581dc500773bdedfeab6287",
  "mode": "clue_ladder",
  "answerStateId": "US-VA",
  "orderedClueIds": [
    "va.time.eastern",
    "va.parks.formal-1",
    "va.area.rank-36-40",
    "va.highpoint.5000-6000",
    "va.nps.shenandoah",
    "va.places.top-two-2025",
    "va.postal"
  ],
  "dataSnapshotId": "us-states-2026-09-06-v1",
  "clueSetVersion": "short-seven-all-states-v1",
  "scoring": {
    "maxByRung": [
      1000,
      900,
      800,
      700,
      600,
      500,
      400
    ],
    "wrongGuessPenalty": 50
  },
  "seed": "short-seven-all-states-v1",
  "generatedAt": "2026-09-06T16:00:00Z",
  "validatorVersion": "clue-ladder-1"
}
