{
  "puzzleId": "cl-a35e6a3a7de773dfdd916caa",
  "dataContentSha256": "f9d1b24aa47bb4729d03963b6612b553f61e2e058581dc500773bdedfeab6287",
  "mode": "clue_ladder",
  "answerStateId": "US-AL",
  "orderedClueIds": [
    "al.population.5-6m",
    "al.history.1810s",
    "al.highpoint.2000-2500",
    "al.time.central-all",
    "al.borders.segment-set",
    "al.cities.top2-2025",
    "al.silhouette"
  ],
  "dataSnapshotId": "us-states-2026-09-06-v1",
  "clueSetVersion": "short-seven-all-states-v1",
  "scoring": {
    "maxByRung": [
      1000,
      900,
      800,
      700,
      600,
      500,
      400
    ],
    "wrongGuessPenalty": 50
  },
  "seed": "short-seven-all-states-v1",
  "generatedAt": "2026-09-06T16:00:00Z",
  "validatorVersion": "clue-ladder-1"
}
