{
  "puzzleId": "cl-4bb06196fc8bb58a232fae88",
  "dataContentSha256": "f9d1b24aa47bb4729d03963b6612b553f61e2e058581dc500773bdedfeab6287",
  "mode": "clue_ladder",
  "answerStateId": "US-HI",
  "orderedClueIds": [
    "hi.parks.formal-2",
    "hi.history.order-41-50",
    "hi.population.1000000-1500000",
    "hi.area.rank-46-50",
    "hi.nps.pearl-harbor",
    "hi.places.none-incorporated",
    "hi.postal"
  ],
  "dataSnapshotId": "us-states-2026-09-06-v1",
  "clueSetVersion": "short-seven-all-states-v1",
  "scoring": {
    "maxByRung": [
      1000,
      900,
      800,
      700,
      600,
      500,
      400
    ],
    "wrongGuessPenalty": 50
  },
  "seed": "short-seven-all-states-v1",
  "generatedAt": "2026-09-06T16:00:00Z",
  "validatorVersion": "clue-ladder-1"
}
