{
  "puzzleId": "cl-c08fd7a244077f09885d7b99",
  "dataContentSha256": "f9d1b24aa47bb4729d03963b6612b553f61e2e058581dc500773bdedfeab6287",
  "mode": "clue_ladder",
  "answerStateId": "US-SC",
  "orderedClueIds": [
    "sc.time.eastern",
    "sc.parks.formal-1",
    "sc.area.rank-36-40",
    "sc.history.1780s",
    "sc.nps.congaree",
    "sc.places.top-two-2025",
    "sc.postal"
  ],
  "dataSnapshotId": "us-states-2026-09-06-v1",
  "clueSetVersion": "short-seven-all-states-v1",
  "scoring": {
    "maxByRung": [
      1000,
      900,
      800,
      700,
      600,
      500,
      400
    ],
    "wrongGuessPenalty": 50
  },
  "seed": "short-seven-all-states-v1",
  "generatedAt": "2026-09-06T16:00:00Z",
  "validatorVersion": "clue-ladder-1"
}
