{
  "puzzleId": "cl-841a43b9ec7252068826e609",
  "dataContentSha256": "f9d1b24aa47bb4729d03963b6612b553f61e2e058581dc500773bdedfeab6287",
  "mode": "clue_ladder",
  "answerStateId": "US-MN",
  "orderedClueIds": [
    "mn.parks.formal-1",
    "mn.time.central",
    "mn.highpoint.2000-3000",
    "mn.population.5000000-6000000",
    "mn.nps.voyageurs",
    "mn.places.top-two-2025",
    "mn.postal"
  ],
  "dataSnapshotId": "us-states-2026-09-06-v1",
  "clueSetVersion": "short-seven-all-states-v1",
  "scoring": {
    "maxByRung": [
      1000,
      900,
      800,
      700,
      600,
      500,
      400
    ],
    "wrongGuessPenalty": 50
  },
  "seed": "short-seven-all-states-v1",
  "generatedAt": "2026-09-06T16:00:00Z",
  "validatorVersion": "clue-ladder-1"
}
