{
  "puzzleId": "cl-4e4a735c73abd0e24694b663",
  "dataContentSha256": "f9d1b24aa47bb4729d03963b6612b553f61e2e058581dc500773bdedfeab6287",
  "mode": "clue_ladder",
  "answerStateId": "US-SD",
  "orderedClueIds": [
    "sd.time.central-mountain",
    "sd.history.order-31-40",
    "sd.population.500000-1000000",
    "sd.area.rank-16-20",
    "sd.nps.mount-rushmore",
    "sd.places.top-two-2025",
    "sd.postal"
  ],
  "dataSnapshotId": "us-states-2026-09-06-v1",
  "clueSetVersion": "short-seven-all-states-v1",
  "scoring": {
    "maxByRung": [
      1000,
      900,
      800,
      700,
      600,
      500,
      400
    ],
    "wrongGuessPenalty": 50
  },
  "seed": "short-seven-all-states-v1",
  "generatedAt": "2026-09-06T16:00:00Z",
  "validatorVersion": "clue-ladder-1"
}
