{
  "puzzleId": "cl-125569cbd8b1be57a714676d",
  "dataContentSha256": "f9d1b24aa47bb4729d03963b6612b553f61e2e058581dc500773bdedfeab6287",
  "mode": "clue_ladder",
  "answerStateId": "US-IA",
  "orderedClueIds": [
    "ia.parks.formal-0",
    "ia.time.central-all",
    "ia.history.1840s",
    "ia.area.rank-21-25",
    "ia.population.3-3_5m",
    "ia.highpoint.1500-2000",
    "ia.postal"
  ],
  "dataSnapshotId": "us-states-2026-09-06-v1",
  "clueSetVersion": "short-seven-all-states-v1",
  "scoring": {
    "maxByRung": [
      1000,
      900,
      800,
      700,
      600,
      500,
      400
    ],
    "wrongGuessPenalty": 50
  },
  "seed": "short-seven-all-states-v1",
  "generatedAt": "2026-09-06T16:00:00Z",
  "validatorVersion": "clue-ladder-1"
}
