{
  "puzzleId": "cl-0b8144b72aa3e8a678d887d6",
  "dataContentSha256": "f9d1b24aa47bb4729d03963b6612b553f61e2e058581dc500773bdedfeab6287",
  "mode": "clue_ladder",
  "answerStateId": "US-KS",
  "orderedClueIds": [
    "ks.parks.formal-0",
    "ks.population.2_5-3m",
    "ks.area.rank-11-15",
    "ks.time.central-mountain",
    "ks.history.1860s",
    "ks.highpoint.4000-4500",
    "ks.postal"
  ],
  "dataSnapshotId": "us-states-2026-09-06-v1",
  "clueSetVersion": "short-seven-all-states-v1",
  "scoring": {
    "maxByRung": [
      1000,
      900,
      800,
      700,
      600,
      500,
      400
    ],
    "wrongGuessPenalty": 50
  },
  "seed": "short-seven-all-states-v1",
  "generatedAt": "2026-09-06T16:00:00Z",
  "validatorVersion": "clue-ladder-1"
}
