{
  "puzzleId": "cl-5477f35d0d1c3d9d77f9cec0",
  "dataContentSha256": "f9d1b24aa47bb4729d03963b6612b553f61e2e058581dc500773bdedfeab6287",
  "mode": "clue_ladder",
  "answerStateId": "US-WI",
  "orderedClueIds": [
    "wi.parks.formal-0",
    "wi.time.central",
    "wi.history.order-21-30",
    "wi.population.5000000-6000000",
    "wi.nps.apostle-islands",
    "wi.places.top-two-2025",
    "wi.postal"
  ],
  "dataSnapshotId": "us-states-2026-09-06-v1",
  "clueSetVersion": "short-seven-all-states-v1",
  "scoring": {
    "maxByRung": [
      1000,
      900,
      800,
      700,
      600,
      500,
      400
    ],
    "wrongGuessPenalty": 50
  },
  "seed": "short-seven-all-states-v1",
  "generatedAt": "2026-09-06T16:00:00Z",
  "validatorVersion": "clue-ladder-1"
}
