{
  "puzzleId": "cl-8f9baf835ebcbbfb64d43506",
  "dataContentSha256": "f9d1b24aa47bb4729d03963b6612b553f61e2e058581dc500773bdedfeab6287",
  "mode": "clue_ladder",
  "answerStateId": "US-ID",
  "orderedClueIds": [
    "id.parks.formal-1",
    "id.highpoint.11000-13000",
    "id.time.mountain-pacific",
    "id.population.1500000-2500000",
    "id.nps.craters-of-the-moon",
    "id.places.top-two-2025",
    "id.postal"
  ],
  "dataSnapshotId": "us-states-2026-09-06-v1",
  "clueSetVersion": "short-seven-all-states-v1",
  "scoring": {
    "maxByRung": [
      1000,
      900,
      800,
      700,
      600,
      500,
      400
    ],
    "wrongGuessPenalty": 50
  },
  "seed": "short-seven-all-states-v1",
  "generatedAt": "2026-09-06T16:00:00Z",
  "validatorVersion": "clue-ladder-1"
}
