{
  "puzzleId": "cl-88eb70b36ea4909096fba614",
  "dataContentSha256": "f9d1b24aa47bb4729d03963b6612b553f61e2e058581dc500773bdedfeab6287",
  "mode": "clue_ladder",
  "answerStateId": "US-OR",
  "orderedClueIds": [
    "or.area.rank-6-10",
    "or.history.order-31-40",
    "or.time.mountain-pacific",
    "or.population.3500000-4500000",
    "or.nps.crater-lake",
    "or.places.top-two-2025",
    "or.postal"
  ],
  "dataSnapshotId": "us-states-2026-09-06-v1",
  "clueSetVersion": "short-seven-all-states-v1",
  "scoring": {
    "maxByRung": [
      1000,
      900,
      800,
      700,
      600,
      500,
      400
    ],
    "wrongGuessPenalty": 50
  },
  "seed": "short-seven-all-states-v1",
  "generatedAt": "2026-09-06T16:00:00Z",
  "validatorVersion": "clue-ladder-1"
}
