{
  "puzzleId": "cl-7706d575fdc0b5be47a63e8e",
  "dataContentSha256": "f9d1b24aa47bb4729d03963b6612b553f61e2e058581dc500773bdedfeab6287",
  "mode": "clue_ladder",
  "answerStateId": "US-FL",
  "orderedClueIds": [
    "fl.area.rank-26-30",
    "fl.history.order-21-30",
    "fl.population.20000000-35000000",
    "fl.highpoint.0-1000",
    "fl.nps.everglades",
    "fl.places.top-two-2025",
    "fl.postal"
  ],
  "dataSnapshotId": "us-states-2026-09-06-v1",
  "clueSetVersion": "short-seven-all-states-v1",
  "scoring": {
    "maxByRung": [
      1000,
      900,
      800,
      700,
      600,
      500,
      400
    ],
    "wrongGuessPenalty": 50
  },
  "seed": "short-seven-all-states-v1",
  "generatedAt": "2026-09-06T16:00:00Z",
  "validatorVersion": "clue-ladder-1"
}
