{
  "puzzleId": "cl-3ec0ffb7025ac8660593a07c",
  "dataContentSha256": "f9d1b24aa47bb4729d03963b6612b553f61e2e058581dc500773bdedfeab6287",
  "mode": "clue_ladder",
  "answerStateId": "US-AK",
  "orderedClueIds": [
    "ak.population.0_5-1m",
    "ak.history.1950s",
    "ak.area.rank-1-5",
    "ak.highpoint.15000-plus",
    "ak.time.alaska-aleutian",
    "ak.parks.formal-8",
    "ak.postal"
  ],
  "dataSnapshotId": "us-states-2026-09-06-v1",
  "clueSetVersion": "short-seven-all-states-v1",
  "scoring": {
    "maxByRung": [
      1000,
      900,
      800,
      700,
      600,
      500,
      400
    ],
    "wrongGuessPenalty": 50
  },
  "seed": "short-seven-all-states-v1",
  "generatedAt": "2026-09-06T16:00:00Z",
  "validatorVersion": "clue-ladder-1"
}
