{
  "puzzleId": "cl-6b60035b5dcf568777f71a2e",
  "dataContentSha256": "5d1446968d556224189f4cb52d824ad4b10586a20d52ba11de02d53ad3440fdb",
  "mode": "clue_ladder",
  "answerStateId": "US-CT",
  "orderedClueIds": [
    "ct.history.1788",
    "ct.parks.formal-0",
    "ct.time.eastern-all",
    "ct.area.rank-46-50",
    "ct.highpoint.2000-2500",
    "ct.cities.top2-2025",
    "ct.postal"
  ],
  "dataSnapshotId": "us-states-2026-09-05-v3",
  "clueSetVersion": "short-seven-batch-01-v1",
  "scoring": {
    "maxByRung": [
      1000,
      900,
      800,
      700,
      600,
      500,
      400
    ],
    "wrongGuessPenalty": 50
  },
  "seed": "short-seven-batch-01-v1",
  "generatedAt": "2026-09-06T00:09:09.920Z",
  "validatorVersion": "clue-ladder-1"
}
