{
  "puzzleId": "cl-b220005739ab1d47ef91249e",
  "dataContentSha256": "f9d1b24aa47bb4729d03963b6612b553f61e2e058581dc500773bdedfeab6287",
  "mode": "clue_ladder",
  "answerStateId": "US-VT",
  "orderedClueIds": [
    "vt.time.eastern",
    "vt.parks.formal-0",
    "vt.area.rank-41-45",
    "vt.population.500000-1000000",
    "vt.nps.marsh-billings-rockefeller",
    "vt.places.top-two-2025",
    "vt.postal"
  ],
  "dataSnapshotId": "us-states-2026-09-06-v1",
  "clueSetVersion": "short-seven-all-states-v1",
  "scoring": {
    "maxByRung": [
      1000,
      900,
      800,
      700,
      600,
      500,
      400
    ],
    "wrongGuessPenalty": 50
  },
  "seed": "short-seven-all-states-v1",
  "generatedAt": "2026-09-06T16:00:00Z",
  "validatorVersion": "clue-ladder-1"
}
